<?xml version="1.0" encoding="UTF-8"?>
<?xml-stylesheet type="text/xsl" href="car-rental.xsl"?>
<!-- Дані сервісу оренди автомобілів: автопарк, клієнти та оренди. -->
<cr:carRental xmlns:cr="http://nure.ua/knt-23-1/kravchenko/car-rental"
              xmlns:xsi="http://www.w3.org/2001/XMLSchema-instance"
              xsi:schemaLocation="http://nure.ua/knt-23-1/kravchenko/car-rental car-rental.xsd"
              generatedAt="2026-10-12T18:00:00"
              source="RENTAL_SERVICE">

    <!-- ===== Fleet Service ===== -->
    <cr:fleet>
        <cr:carModel id="M001">
            <cr:brand>Toyota</cr:brand>
            <cr:name>Corolla</cr:name>
            <cr:year>2022</cr:year>
            <cr:engineType>HYBRID</cr:engineType>
            <cr:transmission>AUTOMATIC</cr:transmission>
            <cr:seats>5</cr:seats>
            <cr:dailyRate>1450.00</cr:dailyRate>
            <cr:description>Економний гібридний седан для міста та траси.</cr:description>
            <cr:car plateNumber="AX1234BC">
                <cr:color>Білий</cr:color>
                <cr:mileage>48210</cr:mileage>
                <cr:status>RENTED</cr:status>
                <cr:lastServiceDate>2026-08-30</cr:lastServiceDate>
            </cr:car>
            <!-- xsd:all: інший порядок елементів, без необов'язкової дати ТО -->
            <cr:car plateNumber="KA5678OM">
                <cr:status>AVAILABLE</cr:status>
                <cr:color>Сірий</cr:color>
                <cr:mileage>15300</cr:mileage>
            </cr:car>
        </cr:carModel>

        <cr:carModel id="M002">
            <cr:brand>Tesla</cr:brand>
            <cr:name>Model 3</cr:name>
            <cr:year>2024</cr:year>
            <cr:engineType>ELECTRIC</cr:engineType>
            <cr:transmission>AUTOMATIC</cr:transmission>
            <cr:seats>5</cr:seats>
            <cr:dailyRate>2900.50</cr:dailyRate>
            <cr:car plateNumber="BH0001EE">
                <cr:color>Чорний</cr:color>
                <cr:mileage>9800</cr:mileage>
                <cr:status>AVAILABLE</cr:status>
                <cr:lastServiceDate>2026-09-15</cr:lastServiceDate>
            </cr:car>
        </cr:carModel>

        <!-- Модель без опису та без автомобілів (усі вже списані) -->
        <cr:carModel id="M003">
            <cr:brand>Renault</cr:brand>
            <cr:name>Trafic</cr:name>
            <cr:year>2019</cr:year>
            <cr:engineType>DIESEL</cr:engineType>
            <cr:transmission>MANUAL</cr:transmission>
            <cr:seats>9</cr:seats>
            <cr:dailyRate>1800.00</cr:dailyRate>
        </cr:carModel>

        <cr:carModel id="M004">
            <cr:brand>Skoda</cr:brand>
            <cr:name>Octavia</cr:name>
            <cr:year>2021</cr:year>
            <cr:engineType>PETROL</cr:engineType>
            <cr:transmission>MANUAL</cr:transmission>
            <cr:seats>5</cr:seats>
            <cr:dailyRate>1200.00</cr:dailyRate>
            <cr:description>Місткий універсал з великим багажником.</cr:description>
            <cr:car plateNumber="AI4321KX">
                <cr:mileage>120450</cr:mileage>
                <cr:color>Синій</cr:color>
                <cr:status>MAINTENANCE</cr:status>
                <cr:lastServiceDate>2026-10-10</cr:lastServiceDate>
            </cr:car>
        </cr:carModel>
    </cr:fleet>

    <!-- ===== Customer Service ===== -->
    <cr:customers>
        <cr:customer id="C0001" discountPercent="10">
            <cr:firstName>Олена</cr:firstName>
            <cr:lastName>Коваль</cr:lastName>
            <cr:phoneNumber>0671234567</cr:phoneNumber>
            <cr:email>olena.koval@example.com</cr:email>
            <cr:birthDate>1995-04-21</cr:birthDate>
            <cr:driverLicense>AXA123456</cr:driverLicense>
        </cr:customer>
        <!-- Клієнт без e-mail і без знижки -->
        <cr:customer id="C0002">
            <cr:firstName>Андрій</cr:firstName>
            <cr:lastName>Мельник</cr:lastName>
            <cr:phoneNumber>0509876543</cr:phoneNumber>
            <cr:birthDate>1988-11-02</cr:birthDate>
            <cr:driverLicense>KXE654321</cr:driverLicense>
        </cr:customer>
        <cr:customer id="C0003" discountPercent="0">
            <cr:firstName>Ірина</cr:firstName>
            <cr:lastName>Шевчук</cr:lastName>
            <cr:phoneNumber>0931112233</cr:phoneNumber>
            <cr:email>i.shevchuk@example.org</cr:email>
            <cr:birthDate>2003-01-30</cr:birthDate>
            <cr:driverLicense>BXO000777</cr:driverLicense>
        </cr:customer>
    </cr:customers>

    <!-- ===== Rental Service ===== -->
    <cr:rentals>
        <!-- Активна оренда з додатковими послугами, оплата карткою -->
        <cr:rental id="100001" customerId="C0001" carPlate="AX1234BC">
            <cr:startDate>2026-10-10</cr:startDate>
            <cr:endDate>2026-10-15</cr:endDate>
            <cr:dailyRate>1450.00</cr:dailyRate>
            <cr:extras>
                <cr:extra price="150.00">CHILD_SEAT</cr:extra>
                <cr:extra price="300.00">FULL_INSURANCE</cr:extra>
            </cr:extras>
            <cr:totalCost>6930.00</cr:totalCost>
            <cr:status>ACTIVE</cr:status>
            <cr:payment>
                <cr:card>
                    <cr:maskedNumber>**** **** **** 4821</cr:maskedNumber>
                    <cr:paidAt>2026-10-10T09:15:00</cr:paidAt>
                </cr:card>
            </cr:payment>
        </cr:rental>
        <!-- Завершена оренда без додаткових послуг, оплата готівкою -->
        <cr:rental id="100002" customerId="C0002" carPlate="KA5678OM">
            <cr:startDate>2026-09-01</cr:startDate>
            <cr:endDate>2026-09-03</cr:endDate>
            <cr:dailyRate>1450.00</cr:dailyRate>
            <cr:totalCost>2900.00</cr:totalCost>
            <cr:status>COMPLETED</cr:status>
            <cr:payment>
                <cr:cash>
                    <cr:receiptNumber>RC-004512</cr:receiptNumber>
                    <cr:paidAt>2026-09-03T18:40:00</cr:paidAt>
                </cr:cash>
            </cr:payment>
        </cr:rental>
        <!-- Майбутня оренда, ще не оплачена -->
        <cr:rental id="100003" customerId="C0003" carPlate="BH0001EE">
            <cr:startDate>2026-10-20</cr:startDate>
            <cr:endDate>2026-10-22</cr:endDate>
            <cr:dailyRate>2900.50</cr:dailyRate>
            <cr:extras>
                <cr:extra price="200.00">GPS</cr:extra>
            </cr:extras>
            <cr:totalCost>6001.00</cr:totalCost>
            <cr:status>BOOKED</cr:status>
            <cr:payment>
                <cr:pending dueDate="2026-10-19"/>
            </cr:payment>
        </cr:rental>
    </cr:rentals>
</cr:carRental>
